{
  "study_id": "CXR1007",
  "image_id": "CXR1007_IM-0008-1001",
  "view": "Frontal",
  "vision_candidates": [
    {
      "finding": "Pneumothorax",
      "model_score": 0.0597,
      "is_baseline": true,
      "selection_reason": "baseline_routine"
    },
    {
      "finding": "Effusion",
      "model_score": 0.0088,
      "is_baseline": true,
      "selection_reason": "baseline_routine"
    },
    {
      "finding": "Consolidation",
      "model_score": 0.1026,
      "is_baseline": true,
      "selection_reason": "baseline_routine"
    },
    {
      "finding": "Cardiomegaly",
      "model_score": 0.0029,
      "is_baseline": true,
      "selection_reason": "baseline_routine"
    },
    {
      "finding": "Infiltration",
      "model_score": 0.3772,
      "is_baseline": false,
      "selection_reason": "top_3_activation"
    },
    {
      "finding": "Pleural_Thickening",
      "model_score": 0.2904,
      "is_baseline": false,
      "selection_reason": "top_3_activation"
    },
    {
      "finding": "Fibrosis",
      "model_score": 0.2864,
      "is_baseline": false,
      "selection_reason": "top_3_activation"
    }
  ],
  "questions_evaluated": [
    {
      "question_id": "Q_PNEUMOTHORAX_PRESENCE",
      "finding": "Pneumothorax",
      "level": 1,
      "question_text": "Is there radiographic evidence of a pneumothorax?",
      "options": [
        "yes",
        "no",
        "uncertain"
      ],
      "model_score": 0.0597,
      "answer": "uncertain"
    },
    {
      "question_id": "Q_PNEUMOTHORAX_LOCATION",
      "finding": "Pneumothorax",
      "level": 2,
      "question_text": "Where is the pneumothorax located (e.g., right, left, apical)?",
      "options": [
        "right",
        "left",
        "bilateral",
        "right_upper_lobe",
        "right_middle_lobe",
        "right_lower_lobe",
        "left_upper_lobe",
        "left_lower_lobe",
        "basilar",
        "apical",
        "retrocardiac",
        "mediastinum",
        "diffuse",
        "unspecified"
      ],
      "model_score": 0.0597,
      "answer": "unspecified"
    },
    {
      "question_id": "Q_EFFUSION_PRESENCE",
      "finding": "Effusion",
      "level": 1,
      "question_text": "Is there evidence of pleural effusion or costophrenic angle blunting?",
      "options": [
        "yes",
        "no",
        "uncertain"
      ],
      "model_score": 0.0088,
      "answer": "uncertain"
    },
    {
      "question_id": "Q_EFFUSION_LOCATION",
      "finding": "Effusion",
      "level": 2,
      "question_text": "Where is the pleural effusion located (e.g., right, left, bilateral)?",
      "options": [
        "right",
        "left",
        "bilateral",
        "right_upper_lobe",
        "right_middle_lobe",
        "right_lower_lobe",
        "left_upper_lobe",
        "left_lower_lobe",
        "basilar",
        "apical",
        "retrocardiac",
        "mediastinum",
        "diffuse",
        "unspecified"
      ],
      "model_score": 0.0088,
      "answer": "unspecified"
    },
    {
      "question_id": "Q_CONSOLIDATION_PRESENCE",
      "finding": "Consolidation",
      "level": 1,
      "question_text": "Is there focal or dense airspace consolidation?",
      "options": [
        "yes",
        "no",
        "uncertain"
      ],
      "model_score": 0.1026,
      "answer": "uncertain"
    },
    {
      "question_id": "Q_CONSOLIDATION_LOCATION",
      "finding": "Consolidation",
      "level": 2,
      "question_text": "Which lung lobe or region contains the consolidation?",
      "options": [
        "right",
        "left",
        "bilateral",
        "right_upper_lobe",
        "right_middle_lobe",
        "right_lower_lobe",
        "left_upper_lobe",
        "left_lower_lobe",
        "basilar",
        "apical",
        "retrocardiac",
        "mediastinum",
        "diffuse",
        "unspecified"
      ],
      "model_score": 0.1026,
      "answer": "unspecified"
    },
    {
      "question_id": "Q_CARDIOMEGALY_PRESENCE",
      "finding": "Cardiomegaly",
      "level": 1,
      "question_text": "Is cardiomegaly or prominent cardiac enlargement present?",
      "options": [
        "yes",
        "no",
        "uncertain"
      ],
      "model_score": 0.0029,
      "answer": "uncertain"
    },
    {
      "question_id": "Q_CARDIOMEGALY_LOCATION",
      "finding": "Cardiomegaly",
      "level": 2,
      "question_text": "Is the enlargement generalized or specific to cardiac chambers?",
      "options": [
        "right",
        "left",
        "bilateral",
        "right_upper_lobe",
        "right_middle_lobe",
        "right_lower_lobe",
        "left_upper_lobe",
        "left_lower_lobe",
        "basilar",
        "apical",
        "retrocardiac",
        "mediastinum",
        "diffuse",
        "unspecified"
      ],
      "model_score": 0.0029,
      "answer": "unspecified"
    },
    {
      "question_id": "Q_INFILTRATION_PRESENCE",
      "finding": "Infiltration",
      "level": 1,
      "question_text": "Are there infiltrative or hazy airspace opacities?",
      "options": [
        "yes",
        "no",
        "uncertain"
      ],
      "model_score": 0.3772,
      "answer": "uncertain"
    },
    {
      "question_id": "Q_INFILTRATION_LOCATION",
      "finding": "Infiltration",
      "level": 2,
      "question_text": "Where are the infiltrates distributed (e.g., right, left, bilateral)?",
      "options": [
        "right",
        "left",
        "bilateral",
        "right_upper_lobe",
        "right_middle_lobe",
        "right_lower_lobe",
        "left_upper_lobe",
        "left_lower_lobe",
        "basilar",
        "apical",
        "retrocardiac",
        "mediastinum",
        "diffuse",
        "unspecified"
      ],
      "model_score": 0.3772,
      "answer": "unspecified"
    },
    {
      "question_id": "Q_PLEURAL_THICKENING_PRESENCE",
      "finding": "Pleural_Thickening",
      "level": 1,
      "question_text": "Is there evidence of pleural thickening or apical capping?",
      "options": [
        "yes",
        "no",
        "uncertain"
      ],
      "model_score": 0.2904,
      "answer": "uncertain"
    },
    {
      "question_id": "Q_PLEURAL_THICKENING_LOCATION",
      "finding": "Pleural_Thickening",
      "level": 2,
      "question_text": "Where is the pleural thickening located (e.g., right, left, apical)?",
      "options": [
        "right",
        "left",
        "bilateral",
        "right_upper_lobe",
        "right_middle_lobe",
        "right_lower_lobe",
        "left_upper_lobe",
        "left_lower_lobe",
        "basilar",
        "apical",
        "retrocardiac",
        "mediastinum",
        "diffuse",
        "unspecified"
      ],
      "model_score": 0.2904,
      "answer": "unspecified"
    },
    {
      "question_id": "Q_FIBROSIS_PRESENCE",
      "finding": "Fibrosis",
      "level": 1,
      "question_text": "Is there evidence of pulmonary fibrosis, reticular markings, or scarring?",
      "options": [
        "yes",
        "no",
        "uncertain"
      ],
      "model_score": 0.2864,
      "answer": "uncertain"
    },
    {
      "question_id": "Q_FIBROSIS_LOCATION",
      "finding": "Fibrosis",
      "level": 2,
      "question_text": "Where are the fibrotic markings located (e.g., apical, bibasilar, diffuse)?",
      "options": [
        "right",
        "left",
        "bilateral",
        "right_upper_lobe",
        "right_middle_lobe",
        "right_lower_lobe",
        "left_upper_lobe",
        "left_lower_lobe",
        "basilar",
        "apical",
        "retrocardiac",
        "mediastinum",
        "diffuse",
        "unspecified"
      ],
      "model_score": 0.2864,
      "answer": "unspecified"
    }
  ],
  "qa_findings": [
    {
      "finding": "Pneumothorax",
      "presence": "uncertain",
      "location": "unspecified",
      "severity": "unspecified",
      "model_score": 0.0597,
      "evidence_source": "vision_model"
    },
    {
      "finding": "Effusion",
      "presence": "uncertain",
      "location": "unspecified",
      "severity": "unspecified",
      "model_score": 0.0088,
      "evidence_source": "vision_model"
    },
    {
      "finding": "Consolidation",
      "presence": "uncertain",
      "location": "unspecified",
      "severity": "unspecified",
      "model_score": 0.1026,
      "evidence_source": "vision_model"
    },
    {
      "finding": "Cardiomegaly",
      "presence": "uncertain",
      "location": "unspecified",
      "severity": "unspecified",
      "model_score": 0.0029,
      "evidence_source": "vision_model"
    },
    {
      "finding": "Infiltration",
      "presence": "uncertain",
      "location": "unspecified",
      "severity": "unspecified",
      "model_score": 0.3772,
      "evidence_source": "vision_model"
    },
    {
      "finding": "Pleural_Thickening",
      "presence": "uncertain",
      "location": "unspecified",
      "severity": "unspecified",
      "model_score": 0.2904,
      "evidence_source": "vision_model"
    },
    {
      "finding": "Fibrosis",
      "presence": "uncertain",
      "location": "unspecified",
      "severity": "unspecified",
      "model_score": 0.2864,
      "evidence_source": "vision_model"
    }
  ]
}